{
  "capture": {
    "attempts": [
      {
        "capture_end_ns": 163179912182496,
        "capture_start_ns": 163179626200102,
        "decode_scan_complete_ns": 163179912184451,
        "marker_found": true,
        "pane_marker_pixels": [
          {
            "pane_index": 0,
            "pixels": 18240
          },
          {
            "pane_index": 1,
            "pixels": 0
          }
        ],
        "sequence": 0
      }
    ],
    "child_receipt_ns": 163179623927393,
    "found_sequence": 0,
    "marker_trigger_ns": 163179621632264,
    "quantization_ns": 285984349
  },
  "case_id": "measured-08-0112-inactive-scaling-2",
  "cell": {
    "activity": "focused-only",
    "cached_rows_per_pane": 4096,
    "name": "inactive-scaling-2",
    "operation": "small-marker",
    "pane_count": 2,
    "viewport": "live"
  },
  "cleanup": {
    "failure": null,
    "namespace_absent": true,
    "processes_absent": true,
    "trace_closed": true,
    "verified": true,
    "windows_absent": true
  },
  "execution_index": 112,
  "failure": null,
  "isolation": {
    "focus_preserved": true,
    "monitor": "DP-2",
    "placement_preserved": true,
    "target_owned": true,
    "unrelated_activity_untouched": true,
    "workspace": 8
  },
  "iteration": 8,
  "movement": {
    "configure_events": 0,
    "history_clones": 0,
    "output_enter_events": 0,
    "output_leave_events": 0,
    "pane_frame_rebuilds": 1,
    "position_changes": 0,
    "semantic_applies": 1
  },
  "notes": [
    "native exact-plan collector; screenshot timing is coarse observation, not presentation"
  ],
  "operation_evidence": {
    "completed": true,
    "completed_units": 1,
    "panes": [
      {
        "completed_units": 1,
        "control_bytes": 0,
        "event": "marker_complete",
        "marker_bytes": 126,
        "pane_index": 0,
        "payload_bytes": 0,
        "raw_result": {
          "completed_monotonic_ns": 163179623996468,
          "completed_units": 1,
          "control_bytes": 0,
          "event": "marker_complete",
          "lines": 0,
          "marker_bytes": 126,
          "payload_bytes": 0,
          "pid": 1657801,
          "received_monotonic_ns": 163179623927393,
          "schema": "splinterm.benchmark.child-result.v1",
          "sequence": 1,
          "total_bytes": 126,
          "workload": null
        },
        "workload": "marker"
      }
    ],
    "requested_units": 1,
    "unit": "marker"
  },
  "phase": "measured",
  "plan_sha256": "091cc4d798e0ed460f421902713d1bd17efc2f1e68379f1859da372739d87869",
  "precondition": {
    "activity": {
      "mode": "focused-only",
      "observed_panes": [
        0
      ],
      "proven": true,
      "target_panes": [
        0
      ]
    },
    "panes": [
      {
        "actual_cached_rows": 4096,
        "cached_bytes": 15077376,
        "pane_index": 0,
        "target_cached_rows": 4096,
        "verified": true
      },
      {
        "actual_cached_rows": 4096,
        "cached_bytes": 15077376,
        "pane_index": 1,
        "target_cached_rows": 4096,
        "verified": true
      }
    ],
    "viewport": {
      "final": "live",
      "initial": "live",
      "proven": true,
      "steps": [
        "assert-live"
      ]
    }
  },
  "schema": "splinterm.benchmark.graphical-catchup-report.v1",
  "trace": {
    "ambiguous": false,
    "client_receive_to_pane_commit_ns": 8020432,
    "commit_to_callback_ns": 22921699,
    "records": 6613,
    "run_id": "gc-112-1657773",
    "saturated": false,
    "uncommitted_transactions": 0
  },
  "valid": true
}
