{
  "capture": {
    "attempts": [
      {
        "capture_end_ns": 162341060049061,
        "capture_start_ns": 162340773077416,
        "decode_scan_complete_ns": 162341060050527,
        "marker_found": false,
        "pane_marker_pixels": [
          {
            "pane_index": 0,
            "pixels": 0
          },
          {
            "pane_index": 1,
            "pixels": 0
          },
          {
            "pane_index": 2,
            "pixels": 0
          },
          {
            "pane_index": 3,
            "pixels": 0
          }
        ],
        "sequence": 0
      },
      {
        "capture_end_ns": 162341339161961,
        "capture_start_ns": 162341070151552,
        "decode_scan_complete_ns": 162341339163847,
        "marker_found": true,
        "pane_marker_pixels": [
          {
            "pane_index": 0,
            "pixels": 18240
          },
          {
            "pane_index": 1,
            "pixels": 18240
          },
          {
            "pane_index": 2,
            "pixels": 18240
          },
          {
            "pane_index": 3,
            "pixels": 18240
          }
        ],
        "sequence": 1
      }
    ],
    "child_receipt_ns": 162335796350202,
    "found_sequence": 1,
    "marker_trigger_ns": 162335795140079,
    "quantization_ns": 286973111
  },
  "case_id": "measured-03-0065-ansi-stress",
  "cell": {
    "activity": "all-panes",
    "cached_rows_per_pane": 4096,
    "name": "ansi-stress",
    "operation": "ansi-2000-lines",
    "pane_count": 4,
    "viewport": "live"
  },
  "cleanup": {
    "failure": null,
    "namespace_absent": true,
    "processes_absent": true,
    "trace_closed": true,
    "verified": true,
    "windows_absent": true
  },
  "execution_index": 65,
  "failure": null,
  "isolation": {
    "focus_preserved": true,
    "monitor": "DP-2",
    "placement_preserved": true,
    "target_owned": true,
    "unrelated_activity_untouched": true,
    "workspace": 8
  },
  "iteration": 3,
  "movement": {
    "configure_events": 0,
    "history_clones": 0,
    "output_enter_events": 0,
    "output_leave_events": 0,
    "pane_frame_rebuilds": 42,
    "position_changes": 0,
    "semantic_applies": 500
  },
  "notes": [
    "native exact-plan collector; screenshot timing is coarse observation, not presentation"
  ],
  "operation_evidence": {
    "completed": true,
    "completed_units": 2000,
    "panes": [
      {
        "completed_units": 2000,
        "control_bytes": 7,
        "event": "output_complete",
        "marker_bytes": 126,
        "pane_index": 0,
        "payload_bytes": 190000,
        "raw_result": {
          "completed_monotonic_ns": 162340770966791,
          "completed_units": 2000,
          "control_bytes": 7,
          "event": "write_complete",
          "lines": 2000,
          "marker_bytes": 126,
          "payload_bytes": 190000,
          "pid": 1542707,
          "received_monotonic_ns": 162335796061815,
          "schema": "splinterm.benchmark.child-result.v1",
          "sequence": 1,
          "total_bytes": 190133,
          "workload": "ansi"
        },
        "workload": "ansi"
      },
      {
        "completed_units": 2000,
        "control_bytes": 7,
        "event": "output_complete",
        "marker_bytes": 126,
        "pane_index": 1,
        "payload_bytes": 190000,
        "raw_result": {
          "completed_monotonic_ns": 162340770935291,
          "completed_units": 2000,
          "control_bytes": 7,
          "event": "write_complete",
          "lines": 2000,
          "marker_bytes": 126,
          "payload_bytes": 190000,
          "pid": 1542739,
          "received_monotonic_ns": 162335796253887,
          "schema": "splinterm.benchmark.child-result.v1",
          "sequence": 1,
          "total_bytes": 190133,
          "workload": "ansi"
        },
        "workload": "ansi"
      },
      {
        "completed_units": 2000,
        "control_bytes": 7,
        "event": "output_complete",
        "marker_bytes": 126,
        "pane_index": 2,
        "payload_bytes": 190000,
        "raw_result": {
          "completed_monotonic_ns": 162340770935291,
          "completed_units": 2000,
          "control_bytes": 7,
          "event": "write_complete",
          "lines": 2000,
          "marker_bytes": 126,
          "payload_bytes": 190000,
          "pid": 1542723,
          "received_monotonic_ns": 162335795839500,
          "schema": "splinterm.benchmark.child-result.v1",
          "sequence": 1,
          "total_bytes": 190133,
          "workload": "ansi"
        },
        "workload": "ansi"
      },
      {
        "completed_units": 2000,
        "control_bytes": 7,
        "event": "output_complete",
        "marker_bytes": 126,
        "pane_index": 3,
        "payload_bytes": 190000,
        "raw_result": {
          "completed_monotonic_ns": 162340771166476,
          "completed_units": 2000,
          "control_bytes": 7,
          "event": "write_complete",
          "lines": 2000,
          "marker_bytes": 126,
          "payload_bytes": 190000,
          "pid": 1542760,
          "received_monotonic_ns": 162335796350202,
          "schema": "splinterm.benchmark.child-result.v1",
          "sequence": 1,
          "total_bytes": 190133,
          "workload": "ansi"
        },
        "workload": "ansi"
      }
    ],
    "requested_units": 2000,
    "unit": "output-lines"
  },
  "phase": "measured",
  "plan_sha256": "091cc4d798e0ed460f421902713d1bd17efc2f1e68379f1859da372739d87869",
  "precondition": {
    "activity": {
      "mode": "all-panes",
      "observed_panes": [
        0,
        1,
        2,
        3
      ],
      "proven": true,
      "target_panes": [
        0,
        1,
        2,
        3
      ]
    },
    "panes": [
      {
        "actual_cached_rows": 4096,
        "cached_bytes": 15077376,
        "pane_index": 0,
        "target_cached_rows": 4096,
        "verified": true
      },
      {
        "actual_cached_rows": 4096,
        "cached_bytes": 15077376,
        "pane_index": 1,
        "target_cached_rows": 4096,
        "verified": true
      },
      {
        "actual_cached_rows": 4096,
        "cached_bytes": 15077376,
        "pane_index": 2,
        "target_cached_rows": 4096,
        "verified": true
      },
      {
        "actual_cached_rows": 4096,
        "cached_bytes": 15077376,
        "pane_index": 3,
        "target_cached_rows": 4096,
        "verified": true
      }
    ],
    "viewport": {
      "final": "live",
      "initial": "live",
      "proven": true,
      "steps": [
        "assert-live"
      ]
    }
  },
  "schema": "splinterm.benchmark.graphical-catchup-report.v1",
  "trace": {
    "ambiguous": false,
    "client_receive_to_pane_commit_ns": 269861253,
    "commit_to_callback_ns": 15860117,
    "records": 19191,
    "run_id": "gc-65-1542678",
    "saturated": false,
    "uncommitted_transactions": 333
  },
  "valid": true
}
