{
  "capture": {
    "attempts": [
      {
        "capture_end_ns": 162038518722117,
        "capture_start_ns": 162038370540340,
        "decode_scan_complete_ns": 162038518724003,
        "marker_found": true,
        "pane_marker_pixels": [
          {
            "pane_index": 0,
            "pixels": 18240
          }
        ],
        "sequence": 0
      }
    ],
    "child_receipt_ns": 162038368625677,
    "found_sequence": 0,
    "marker_trigger_ns": 162038368087521,
    "quantization_ns": 148183663
  },
  "case_id": "measured-01-0047-detached-history",
  "cell": {
    "activity": "focused-only",
    "cached_rows_per_pane": 4096,
    "name": "detached-history",
    "operation": "continuing-small-output",
    "pane_count": 1,
    "viewport": "detached"
  },
  "cleanup": {
    "failure": null,
    "namespace_absent": true,
    "processes_absent": true,
    "trace_closed": true,
    "verified": true,
    "windows_absent": true
  },
  "execution_index": 47,
  "failure": null,
  "isolation": {
    "focus_preserved": true,
    "monitor": "DP-2",
    "placement_preserved": true,
    "target_owned": true,
    "unrelated_activity_untouched": true,
    "workspace": 8
  },
  "iteration": 1,
  "movement": {
    "configure_events": 0,
    "history_clones": 4096,
    "output_enter_events": 0,
    "output_leave_events": 0,
    "pane_frame_rebuilds": 1,
    "position_changes": 0,
    "semantic_applies": 1
  },
  "notes": [
    "native exact-plan collector; screenshot timing is coarse observation, not presentation"
  ],
  "operation_evidence": {
    "completed": true,
    "completed_units": 1,
    "panes": [
      {
        "completed_units": 1,
        "control_bytes": 0,
        "event": "output_complete",
        "marker_bytes": 0,
        "pane_index": 0,
        "payload_bytes": 81,
        "raw_result": {
          "completed_monotonic_ns": 162038368652916,
          "completed_units": 1,
          "control_bytes": 0,
          "event": "output_complete",
          "lines": 1,
          "marker_bytes": 0,
          "payload_bytes": 81,
          "pid": 1503170,
          "received_monotonic_ns": 162038368625677,
          "schema": "splinterm.benchmark.child-result.v1",
          "sequence": 2,
          "total_bytes": 81,
          "workload": "plain"
        },
        "workload": "plain"
      }
    ],
    "requested_units": 1,
    "unit": "output-lines"
  },
  "phase": "measured",
  "plan_sha256": "091cc4d798e0ed460f421902713d1bd17efc2f1e68379f1859da372739d87869",
  "precondition": {
    "activity": {
      "mode": "focused-only",
      "observed_panes": [
        0
      ],
      "proven": true,
      "target_panes": [
        0
      ]
    },
    "panes": [
      {
        "actual_cached_rows": 4096,
        "cached_bytes": 15077376,
        "pane_index": 0,
        "target_cached_rows": 4096,
        "verified": true
      }
    ],
    "viewport": {
      "final": "detached",
      "initial": "live",
      "proven": true,
      "steps": [
        "assert-live",
        "scroll-back-one-page",
        "assert-detached"
      ]
    }
  },
  "schema": "splinterm.benchmark.graphical-catchup-report.v1",
  "trace": {
    "ambiguous": false,
    "client_receive_to_pane_commit_ns": 19846866,
    "commit_to_callback_ns": 12571361,
    "records": 3541,
    "run_id": "gc-47-1503140",
    "saturated": false,
    "uncommitted_transactions": 0
  },
  "valid": true
}
